temop,tempo,tempo
200,Boy Fact,Boys possess an unwavering sense of honor...,"upholding integrity, displaying respect, and embracing responsibility in their actions and decisions."
201,Boy Fact,In the realm of a boy's dreams...,"passions flourish, purpose comes alive, and the extraordinary becomes an everyday reality."
202,Boy Fact,Boys carry within them the power of resilience...,"bouncing back from challenges, embracing change, and discovering their inner strength."
203,Boy Fact,Behind a boy's silence lies...,"the weight of unspoken words, depth of introspection, and a unique perspective on the world."
204,Boy Fact,Boys possess an unwavering commitment to their values...,"living with integrity, staying true to themselves, and standing up for what they believe in."
205,Boy Fact,In the depths of a boy's heart...,"love finds its sanctuary, creating connections that transcend time, distance, and circumstances."
206,Boy Fact,Boys carry within them the seeds of greatness...,with the potential to flourish into extraordinary individuals who shape the world around them.
207,Boy Fact,Behind a boy's resilience lies...,"the strength to rise, the determination to persevere, and an unwavering belief in his own abilities."
208,Boy Fact,Boys possess an adventurous spirit...,"embracing new experiences, seeking thrills, and discovering the wonders that the world has to offer."
209,Boy Fact,In the realm of a boy's dreams...,"aspirations take flight, ambitions soar, and the pursuit of excellence becomes a lifelong journey."
210,Boy Fact,Boys carry within them the power to inspire...,"through their words, actions, and authenticity, igniting the flames of passion and change in others."
211,Boy Fact,Behind a boy's laughter hides...,"a genuine joy that radiates from within, brightening the lives of those fortunate enough to witness it."
212,Boy Fact,Boys possess an unwavering loyalty to their loved ones...,"standing by their side, offering unwavering support, and sharing in both the joys and sorrows of life."
213,Boy Fact,In the depths of a boy's dreams lies...,"the transformative power to turn imagination into reality, and to make the world a better place."
214,Boy Fact,Boys carry within them the fire of determination...,"fueling their ambitions, driving them forward, and propelling them to achieve greatness."
215,Boy Fact,Behind a boy's strength lies...,"a heart filled with compassion, kindness, and the capacity to uplift those around him."
216,Boy Fact,Boys possess an unwavering commitment to their friendships...,"nurturing bonds, offering loyalty, and creating memories that last a lifetime."
217,Boy Fact,In the realm of a boy's dreams...,"possibilities abound, transcending boundaries, and shaping the world according to their vision."
218,Heartbreak Fact,"Sometimes, in the midst of love...","hearts shatter, leaving behind fragments that take time to heal."
219,Heartbreak Fact,Behind the veil of vulnerability...,"lies the risk of heartbreak, a reminder of the depth of our emotions."
220,Heartbreak Fact,In the realm of love and loss...,"tears flow, emotions surge, and healing becomes a necessary journey."
221,Heartbreak Fact,Heartbreak knows no boundaries...,"affecting souls across time, cultures, and the complexities of love."
222,Heartbreak Fact,Behind a broken heart resides...,"the strength to rebuild, to find beauty in the healing process."
223,Heartbreak Fact,In the depths of heartache...,"lessons are learned, resilience is discovered, and growth takes root."
224,Heartbreak Fact,Heartbreak serves as a reminder...,"that love, though beautiful, can also bring moments of profound pain."
225,Heartbreak Fact,Behind the tears of heartbreak lies...,"the opportunity for self-reflection, self-discovery, and self-love."
226,Heartbreak Fact,In the realm of shattered dreams...,"hope finds a way to bloom anew, leading to a brighter tomorrow."
227,Heartbreak Fact,Heartbreak shows us the fragility...,"of our emotions, teaching us to treasure and protect our hearts."
228,Heartbreak Fact,Behind a broken heart beats...,"the resilience to mend, to find solace, and to love once again."
229,Heartbreak Fact,In the depths of heartbreak...,"we find the courage to let go, to embrace healing, and to move forward."
230,Heartbreak Fact,Heartbreak teaches us...,"that endings are not always failures, but opportunities for new beginnings."
231,Heartbreak Fact,Behind the pain of heartbreak resides...,"the capacity to empathize with others, to offer comfort and understanding."
232,Heartbreak Fact,In the realm of lost love...,"hearts yearn for what once was, searching for solace in memories."
233,Heartbreak Fact,Heartbreak reveals our strength...,"as we pick up the pieces, rebuild our lives, and find inner resilience."
234,Heartbreak Fact,Behind a broken heart lies...,"the potential for growth, self-discovery, and a renewed sense of purpose."
235,Heartbreak Fact,In the depths of heartache...,"we learn the power of self-love, healing, and the strength to move on."
236,Heartbreak Fact,Heartbreak reminds us...,"that vulnerability is a courageous act, and scars are a testament to our resilience."
237,Heartbreak Fact,Behind the tears of heartbreak...,"lies the hope for a brighter future, where love can bloom once more."
238,Heartbreak Fact,In the realm of healing...,"hearts find solace, strength, and the ability to love again."
239,Heartbreak Fact,"Heartbreak, though painful...","teaches us to value ourselves, set boundaries, and seek healthy love."
240,Heartbreak Fact,"Behind a broken heart, there lies...","the opportunity for self-reflection, personal growth, and transformation."
241,Heartbreak Fact,In the depths of heartbreak...,"we discover the resilience of the human spirit, capable of finding light in darkness."
242,Heartbreak Fact,Heartbreak reminds us...,"of the importance of self-care, surrounding ourselves with support, and allowing time for healing."
243,Heartbreak Fact,Behind the pain of heartbreak...,"lies the potential for self-discovery, reinvention, and a new chapter of life."
244,Heartbreak Fact,In the realm of healing...,"hearts find renewal, forgiveness, and the strength to love again."
245,Heartbreak Fact,"Heartbreak, though difficult...","can be the catalyst for personal growth, self-awareness, and resilience."
246,Heartbreak Fact,Behind a broken heart beats...,"the unwavering hope for a love that will mend, restore, and bring joy once more."
247,Heartbreak Fact,In the depths of heartache...,"lies the opportunity for introspection, learning, and the discovery of inner strength."
248,Heartbreak Fact,"Sometimes, love can be a double-edged sword...",bringing both exquisite joy and profound pain.
249,Heartbreak Fact,Behind the tears of heartbreak...,"lies the resilience to rebuild, to find happiness, and to love again."
250,Heartbreak Fact,In the realm of shattered illusions...,hearts learn to differentiate between what is real and what is not.
251,Heartbreak Fact,Heartbreak teaches us...,"the value of self-worth, the importance of boundaries, and the power of resilience."
252,Heartbreak Fact,Behind a broken heart lies...,"the potential for self-reflection, growth, and inner transformation."
253,Heartbreak Fact,In the depths of heartache...,"we find the strength to release, to heal, and to embrace new beginnings."
254,Heartbreak Fact,Heartbreak reminds us...,"that love is a risk worth taking, even if it means experiencing pain."
255,Heartbreak Fact,Behind the pain of heartbreak resides...,"the courage to face our deepest wounds, allowing them to heal over time."
256,Heartbreak Fact,In the realm of lost love...,we uncover the lessons that were meant to shape us into who we are today.
257,Heartbreak Fact,Heartbreak reveals the flaws...,"in our perceptions, the illusions we create, and the need for authenticity."
258,Heartbreak Fact,Behind a broken heart beats...,"the strength to forgive, to let go, and to embrace the beauty of life once again."
259,Heartbreak Fact,In the depths of heartbreak...,"we learn the importance of self-care, self-love, and setting healthy boundaries."
260,Heartbreak Fact,Heartbreak paves the way...,"for self-discovery, personal growth, and a deeper understanding of ourselves."
261,Heartbreak Fact,Behind the tears of heartbreak hides...,"the resilience to rise, to rebuild, and to find joy in the journey of healing."
262,Heartbreak Fact,In the realm of healing...,"we find the strength to mend our broken pieces, to nurture our hearts, and to love again."
263,Heartbreak Fact,Heartbreak teaches us that...,"endings can be beginnings in disguise, leading us to new paths and opportunities."
264,Heartbreak Fact,"Behind a broken heart, there lies...","the capacity for empathy, compassion, and the ability to truly understand others."
265,Heartbreak Fact,In the depths of heartache...,"we discover our inner resilience, the power to rise above, and the strength to heal."
266,Heartbreak Fact,Heartbreak reminds us that...,vulnerability is not a weakness but a testament to our willingness to love deeply.
267,Heartbreak Fact,"Behind the pain of heartbreak, there is...","the potential for growth, self-discovery, and a stronger sense of self."
268,Heartbreak Fact,In the realm of healing...,"hearts learn to let go of what no longer serves them, making room for new love and joy."
269,Heartbreak Fact,"Heartbreak, though painful...","can be a catalyst for self-reflection, introspection, and profound personal growth."
270,Heartbreak Fact,Behind a broken heart beats...,"the resilience to rebuild, the courage to love again, and the wisdom to protect oneself."
271,Heartbreak Fact,In the depths of heartbreak...,"we find the strength to embrace our emotions, heal our wounds, and find inner peace."
272,Heartbreak Fact,Heartbreak reveals our true strength...,"as we gather our shattered pieces, find resilience, and create a brighter future."
273,Heartbreak Fact,"Behind the tears of heartbreak, there is...","the opportunity to heal, to grow, and to create a life filled with authentic love."
274,Heartbreak Fact,In the realm of healing...,"hearts discover the power of self-love, acceptance, and the beauty of their own journey."
275,Heartbreak Fact,Heartbreak teaches us to...,"value ourselves, set healthy boundaries, and prioritize our own happiness."
276,Heartbreak Fact,"Behind a broken heart, there lies...","the courage to embrace vulnerability, to heal, and to love again with an open heart."
277,Heartbreak Fact,In the depths of heartache...,"we find the strength to rise, the resilience to rebuild, and the hope for a brighter future."
278,Heartbreak Fact,Heartbreak reminds us that...,"healing takes time, self-compassion is essential, and we are capable of finding love once more."
279,Heartbreak Fact,"Sometimes, love leaves us wounded...",with scars that remind us of the depth of our capacity to feel.
280,Heartbreak Fact,"Behind the tears of heartbreak, there lies...","the resilience to rebuild, the strength to heal, and the hope for a brighter future."
281,Heartbreak Fact,In the realm of shattered dreams...,"we learn to pick up the pieces, find strength, and create new beginnings."
282,Heartbreak Fact,Heartbreak teaches us that...,"pain is not our enemy, but a catalyst for growth and self-discovery."
283,Heartbreak Fact,Behind a broken heart lies...,"the opportunity to redefine ourselves, to embrace healing, and to love again."
284,Heartbreak Fact,In the depths of heartache...,"we find the courage to let go, to release the past, and to embrace a new chapter."
285,Heartbreak Fact,Heartbreak reminds us that...,"we are stronger than we think, capable of rising from the ashes and rebuilding our lives."
286,Heartbreak Fact,"Behind the pain of heartbreak, there is...","the wisdom to understand that some love stories are meant to end, paving the way for new beginnings."
287,Heartbreak Fact,In the realm of lost love...,"we discover the depths of our resilience, the power of self-love, and the beauty of our own journey."
288,Heartbreak Fact,Heartbreak reveals the masks we wear...,as we shed the layers of pretense and rediscover our authentic selves.
289,Heartbreak Fact,Behind a broken heart beats...,"the hope for a love that is deeper, truer, and more fulfilling than before."
290,Heartbreak Fact,In the depths of heartbreak...,"we find the strength to redefine ourselves, to reclaim our happiness, and to love again."
291,Heartbreak Fact,Heartbreak paves the way for growth...,"as we learn from our experiences, nurture self-compassion, and forge a stronger sense of self."
292,Heartbreak Fact,"Behind the tears of heartbreak, there lies...","the capacity for empathy, compassion, and a deeper understanding of the human experience."
293,Heartbreak Fact,In the realm of healing...,we learn to appreciate the beauty of impermanence and the transformative power of resilience.
294,Heartbreak Fact,Heartbreak teaches us to value ourselves...,"to recognize our worth, set boundaries, and choose relationships that uplift and empower us."
295,Heartbreak Fact,Behind a broken heart lies...,"the potential for self-discovery, self-love, and the courage to embrace new beginnings."
296,Heartbreak Fact,In the depths of heartache...,"we find the seeds of resilience, the opportunity for growth, and the strength to rebuild."
297,Heartbreak Fact,Heartbreak reminds us that...,vulnerability is not a weakness but a testament to our capacity to love deeply and wholeheartedly.
298,Heartbreak Fact,Behind the pain of heartbreak resides...,"the resilience to heal, the wisdom to learn, and the hope for a brighter future."
299,Heartbreak Fact,In the realm of healing...,"we discover the power of forgiveness, the joy of self-discovery, and the freedom to love again."
300,Heartbreak Fact,"Heartbreak, though painful...","can be a catalyst for self-reflection, personal growth, and a deeper understanding of ourselves."
301,Heartbreak Fact,Behind a broken heart beats...,"the strength to rise, the courage to heal, and the capacity to love even more fiercely."
302,Heartbreak Fact,In the depths of heartbreak...,"we learn to honor our emotions, embrace our journey, and create a life filled with love and joy."
303,Heartbreak Fact,Heartbreak reveals our inner strength...,"as we find the resilience to rebuild, the wisdom to let go, and the courage to love again."
304,Heartbreak Fact,Behind the tears of heartbreak hides...,"the potential for growth, self-discovery, and a renewed sense of purpose and passion."
305,Heartbreak Fact,In the realm of healing...,"hearts find solace, acceptance, and the transformative power of self-love and self-care."
306,Heartbreak Fact,Heartbreak teaches us that...,"endings are not failures, but opportunities for new beginnings and the discovery of our true selves."
307,Heartbreak Fact,"Behind a broken heart, there lies...","the strength to rebuild, the grace to heal, and the capacity to love again, even more authentically."
308,Heartbreak Fact,In the depths of heartbreak...,"we unearth our inner resilience, uncover our true desires, and create a life filled with love and joy."
309,Heartbreak Fact,Heartbreak reminds us that...,"the path to healing is unique for everyone, and it's okay to take the time we need to mend our hearts."
310,Friend Fact,True friendship is like a treasure...,"it shines brighter with time, and its value grows immeasurably."
311,Friend Fact,Behind every great friendship...,"there is a shared history, unbreakable bonds, and endless laughter."
312,Friend Fact,In the realm of true friends...,"we find a safe haven, unwavering support, and endless understanding."
313,Friend Fact,Friendships are like stars...,"even when they're far apart, their presence is always felt in our hearts."
314,Friend Fact,Behind a strong friendship lies...,"a foundation of trust, acceptance, and the freedom to be our authentic selves."
315,Friend Fact,In the depths of true friendship...,"we discover the joy of shared adventures, laughter, and heartfelt conversations."
316,Friend Fact,Friendships are the pillars...,that hold us up during the storms of life and celebrate our triumphs.
317,Friend Fact,Behind every true friend is...,"a confidant, a cheerleader, and a shoulder to lean on in times of need."
318,Friend Fact,In the realm of genuine friendship...,"we find a support system, a source of encouragement, and a family we choose."
319,Friend Fact,Friendships are a tapestry...,"woven with memories, shared experiences, and the threads of unconditional love."
320,Friend Fact,Behind a loyal friend lies...,"the commitment to stand by our side, to offer guidance, and to believe in us."
321,Friend Fact,In the depths of friendship...,"we discover the power of empathy, the beauty of connection, and the joy of being understood."
322,Friend Fact,Friendships are like sunlight...,"they brighten our days, warm our hearts, and make life more beautiful."
323,Friend Fact,Behind a true friend beats...,"a heart that listens, a soul that cares, and a spirit that lifts us up."
324,Friend Fact,In the realm of lasting friendships...,"we find companionship, shared laughter, and the freedom to be our authentic selves."
325,Friend Fact,Friendships are the glue...,that holds us together when life tries to pull us apart.
326,Friend Fact,Behind every genuine friend lies...,"a bond that transcends distance, time, and the ups and downs of life."
327,Friend Fact,In the depths of true friendship...,"we discover the beauty of acceptance, the strength of vulnerability, and the power of connection."
328,Friend Fact,Friendships are like a warm embrace...,"they wrap us in love, comfort, and a sense of belonging."
329,Friend Fact,Behind a trusted friend lies...,"the assurance that we are never alone, that someone always has our back."
330,Friend Fact,In the realm of deep friendships...,"we find a sanctuary where we can be ourselves, celebrate our uniqueness, and grow together."
331,Friend Fact,Friendships are the music...,"that adds rhythm, harmony, and joy to the symphony of our lives."
332,Friend Fact,Behind every loyal friend lies...,"a treasure trove of shared memories, inside jokes, and cherished moments."
333,Friend Fact,In the depths of genuine friendship...,"we discover a safe space to be vulnerable, to share our dreams, and to grow into our best selves."
334,Friend Fact,Friendships are the wings...,"that lift us higher, support our dreams, and help us soar to new heights."
335,Friend Fact,Behind a true friend's smile lies...,"a heart filled with love, compassion, and the genuine desire to see us happy."
336,Friend Fact,In the realm of authentic friendship...,"we find a sanctuary where masks are shed, and we are embraced for who we truly are."
337,Friend Fact,Friendships are the colors...,"that paint our lives with laughter, adventure, and a sense of belonging."
338,Friend Fact,Behind a steadfast friend lies...,"unwavering loyalty, genuine care, and the willingness to walk beside us through thick and thin."
339,Friend Fact,In the depths of true friendship...,"we discover a mirror that reflects our true selves, an anchor that grounds us, and a light that guides us."
